[
  {
    "version": "rava-capability-v0",
    "id": "cap_33bc573c11380a2dc6b5eb74c0748f0b",
    "nonce": "11111111-1111-4111-8111-111111111111",
    "issuer": "rava:human:8a88e3dd7409f195fd52db2d3cba5d72",
    "subject": "rava:agent:8139770ea87d175f56a35466c34c7ecc",
    "resource": "travel.booking",
    "operations": [
      "purchase"
    ],
    "constraints": {
      "max_amount_usd": {
        "integer": 1200
      }
    },
    "expires_at": [
      2027,
      15,
      8,
      0,
      0,
      0,
      0,
      0,
      0
    ],
    "delegable": true,
    "parent_id": null,
    "proof": {
      "signature_hex": "4e37cea5dbc9eb8c02f8dc5b4cfdb2e781340c37b4bf9699a059eea3be1cb3aed4195856450725c9761ad809a3f0a4cebcb94a9c1d5d6df93a7c920a5294d307"
    }
  },
  {
    "version": "rava-capability-v0",
    "id": "cap_faff91b4425d487f1f25c1599cea0be9",
    "nonce": "22222222-2222-4222-8222-222222222222",
    "issuer": "rava:agent:8139770ea87d175f56a35466c34c7ecc",
    "subject": "rava:agent:ed4928c628d1c2c6eae9033890599561",
    "resource": "travel.booking",
    "operations": [
      "purchase"
    ],
    "constraints": {
      "max_amount_usd": {
        "integer": 800
      }
    },
    "expires_at": [
      2023,
      318,
      22,
      13,
      20,
      0,
      0,
      0,
      0
    ],
    "delegable": false,
    "parent_id": "cap_33bc573c11380a2dc6b5eb74c0748f0b",
    "proof": {
      "signature_hex": "f3fdd11e2a9309b187c880f1c933c15720cc96fefcb785c9d0b2daf10735b5fb051d8be9600d631c82c0488015a18b502179f8d9159243ff85e06c8146a8a80e"
    }
  }
]